,rst_name,user_name,review_text,u_rst_tag,ate_menus,date,platform
13,로니로티,나리,매우 불만족... 리뷰사이트를 완벽히 믿지는 말아야 한다는 걸 보여주는 곳  파스타 오자마자 벌레가 보였는데 귀찮아서 그냥 먹었는데 맛도 없어서 얼마 먹지도 않구 나왔음..ㅜ  줄이 상당히 길음 이른 시간에 갔음에도 앞에 일곱 파티가..  다른 메뉴야 상황을 모르겠지만 이 사진의 메뉴들은 상당히 불만족,점심식사 저녁식사 데이트 현장대기필요,,2017년 8월 7일,1
14,로니로티,지또지또해,사람이 많고 인기도 많은듯 근데 양 조절 실패해서 거의 다 남겼다..1인용이 아니라 1.5인분 이런식으로 팔아서 어떤 조합으로 먹어야할지 한참 고민했는데 느끼해서 실패했다..맛은 그냥 대중적인 파스타와 리조또맛(맛없으면 이상한맛) 딱히 두번은 안갈듯,점심식사 저녁식사 데이트 기념일 캐주얼한 시끌벅적한 깔끔한 소개팅,치킨버섯크림리조또 눈꽃치즈토마토스파게티,2020년 2월 12일,1
15,로니로티,또리,갓성비 최고 맛집 :) 하프메뉴가 있어서 둘이서 메뉴 세개 시켜도 부담이 없어서 좋아용 ㅎㅎㅎ 좀 많긴하지만 맛있는 메뉴가 많아서 꼭 2인 3메뉴하게 되는 집! 특히 삼겹살 스테이크 완전 추천합니당,저녁식사 식사모임 데이트 캐주얼한 가성비좋은 푸짐한 시끌벅적한,삼겹살스테이크 게살딥쉬림프파스타 치킨버섯리조또,2020년 1월 31일,1
16,로니로티,먼지구동이,"맛있어요 오이스터파스타, 필라프 둘다 매컴하고 불맛나서 좋어요",저녁식사 가성비좋은 지역주민이찾는,오이스터 크림 스파게티(닭가슴살/베이컨/해산물 선택),2023년 4월 9일,1
17,로니로티,봉구아줌마,음식이 맛있어서 자주 찾는곳.웨이팅도 있지만 그래도 맛있어서 좋다,점심식사 가족외식 캐주얼한 푸짐한 주차불가,게살 딥 쉬림프 스파게티 하와이언 피자 크림 리조또(베이컨/해산물 선택),2023년 3월 21일,1
18,로니로티,이삼,양이 대체적으로 많고 맛있어요! 3명이서 파스타 하나 감튀 하나 피자 하나 시켰는데 피자 남겼어요,점심식사 데이트 예쁜 깔끔한,해산물토마토스파게티 고구마피자 감자튀김,2023년 1월 24일,1
19,로니로티,wsm,로니로티가면 샐러드파스타는 항상 주문할만큼 맛있어요😊 피자는 처음 주문해봤는데 담백하고 맛있었어요. 양도 푸짐해서 4명이서 메뉴 세개만 주문했는데도 배부르게 먹었어요!,점심식사 저녁식사 데이트 캐주얼한 푸짐한 지역주민이찾는,김치필라프 샐러드파스타 리코타치즈피자,2021년 6월 7일,1
20,로니로티,youandme,게살 파스타와 필라프 맛있어요 약간 애매한 시간에 가서 많이 대기 안하고 식사했네요 두명이서 하프 두개로 시켰는데 넉넉한 양이었어요 더 시키면 남겼을거 같아요,점심식사 저녁식사 식사모임 데이트 가족외식 숨은맛집 서민적인 캐주얼한 가성비좋은 푸짐한 이국적/이색적,게살 딥 스파게티 새우 필라프,2020년 10월 4일,1
21,로니로티,오이시쿠루메론빵,"가성비 맛집이라고 들었는데, 맛도 있으면서 음식 양이 진짜 많아요! 하프로 시켰는데도 파스타 양이 정말 많아서 놀랐어요. 전체적으로 분위기도 깔끔하고 좋았어요",저녁식사 식사모임 회식 데이트 캐주얼한 가성비좋은,파스타 피자 스테이크,2020년 7월 21일,1
22,로니로티,녕PD,위생도 괜찮고 일단 가성비 완전 짱짱👍🏻 크림파스타도 금방 물리지 않고 시간지나도 부드러워서 맛있었고 스테이크도 괜찮았어요 샐러드도 많이 나와서 느끼함도 잡아주고요! 가격이 부담스러운데 스테이크가 먹고 싶다면 적당한 것 같아요. 일단 깔끔하고 밝은 분위기가 마음에 들었고 가격도 착하고 맛도 좋으니 특히 학생분들께 추천합니다😀,점심식사 깔끔한 가성비좋은,목살 스테이크 까르보나라,2017년 12월 6일,1
23,로니로티,므앙,가성비가 정말 말도 안되게 좋은데 맛도 있는 곳! 세명이서 저렇게 시키고 잔뜩 남겼다. +노원점도 자주 가는데 점바점 안 심한듯,점심식사 저녁식사 식사모임 데이트 가성비좋은 푸짐한 깔끔한,목살필라프 눈꽃치즈파스타,2022년 8월 10일,1
24,로니로티,정하남,가격도 착하고 양도 많고 너무 좋음 건대 가면 자주 가는 집 중 하나임 개인적으로 서가앤쿡하고 맛 비슷한데 훨씬 가격이 저렴함,점심식사 저녁식사 접대 회식 데이트 기념일 가족외식 캐주얼한 고급스러운 가성비좋은 시끌벅적한 깔끔한,스테이크 스파게티,2017년 11월 6일,1
25,로니로티,워킹뱀부,아마 건대입구에서 가장 가깝게 찾아볼수있는 평타 양식집. 건대이서 이렇다할 파스타맛집이 없어서 그런가 가성비로는 꽤 괜찮음,점심식사 캐주얼한,로제파스타 돼지고기필라프,2019년 10월 26일,1
26,로니로티,세시,웨이팅은 항상 기본 옵션으로 딸려오는 곳. 청결도나 맛은 떨어지지만 가격대비 분위기나 양이 무난해서 인기가 있는 집입니다.,저녁식사 격식있는 시끌벅적한,까르보나라 목살스테이크,2019년 8월 8일,1
27,로니로티,sayhyo,딱 생각하는 그맛이었습니다. 특히 샐러드 소스가 맛있어서 추가해서 먹었네요. 넓고 손님이 많아서 그런지 시끌벅적합니다ㅠㅠ,점심식사 저녁식사 데이트 모임 시끌벅적한 규모가큰 젊은사람이많은,,2017년 11월 5일,1
28,로니로티,하하넘많,대부분 메뉴가 맛있고 실패할 일이 적어요. 목살 스테이크 샐러드는 소스랑 채소들이 잘 어울려요. 양도 많고 맛있습니다~,점심식사 저녁식사 식사모임 깔끔한,목살 스테이크 샐러드 치킨 버섯 크림 리조또,2020년 4월 29일,1
29,로니로티,보리차,깨끗하고 음식 맛있었음 토마토해물파스타랑 목살스테이크먹었는데 토마토해물이더괜춘 담에가면 목살반짜리시키거나 볶음밥먹을듯,아이동반 점심식사 식사모임 데이트 캐주얼한 가성비좋은 푸짐한 시끌벅적한 예쁜,"토마토해물파스타,목살스테이크구이",2020년 8월 7일,1
30,로니로티,영영,건대입구역 내리자마자 있어서 찾기 쉬웠어요! 메뉴도 다양하고 맛도 좋고 무엇보다 저렴합니다! 추천,점심식사 가성비좋은 푸짐한 무료주차,목살스테이크샐러드 오이스터크림리조또,2018년 12월 4일,1
31,로니로티,jung,식사 시간 때 가면 항상 웨이팅이 있다. 분위기도 좋고 맛도 괜찮다. 고기가 좀 질겼다.,점심식사 저녁식사 데이트 시끌벅적한 깔끔한,베이컨까르보나라 목살스테이크샐러드,2020년 7월 12일,1
32,로니로티,리진,건대에서 가성비맛집 찾으라면 여기밖에 생각 안남. 워낙 없어서ㅎㅎ 목살스테이크 가격대비 굿,점심식사 서민적인 시끌벅적한,목살스테이크 오이스터파스타,2019년 9월 1일,1
33,로니로티,moonby,양이 생각보다 많아요 메뉴도 다양해서 좋은 것 같아요 많이 먹으면 좀 물리는 것 같아요,식사모임 데이트 깔끔한,목살필라프,2022년 7월 2일,1
34,로니로티,지니,가격대비 양은 괜찮은데 맛이 너무 일관 된 맛이에요 똑같은 소스를 쓰는 것 같아요,점심식사 저녁식사 식사모임 캐주얼한 가성비좋은 푸짐한,목살스테이크샐러드 해산물올리브파스타,2018년 7월 26일,1
35,로니로티,배고프다,3:30 부터 브레이크 타임 있어요 여러명이서 식사모임하기 딱 좋은 장소 입니다,점심식사 식사모임 서민적인 예쁜 깔끔한,해산물올리브스파게키,2020년 5월 1일,1
36,로니로티,콩순콩순,조명이 예뻐서 사진이 잘 나오는 분위기 맛집. 그리고 음식이 정말 맛있어요:)♡,점심식사 저녁식사 식사모임 데이트 격식있는 가성비좋은 경관/야경이 좋은,목살스테이크 해산물까르보나라,2020년 1월 29일,1
37,로니로티,마싯눈고,등심스테이크샐러드가 맛있다~ 주말이라 웨이팅 조금 있었고 분위기는 좋았음 ㅎㅎ,점심식사 저녁식사 데이트 캐주얼한 시끌벅적한,등심스샐,2019년 11월 28일,1
38,로니로티,우나,가격이 조금 있는대신 양이 많고 맛있어요. 예약하고 가는 게 나을듯.,점심식사 저녁식사 데이트 푸짐한 깔끔한,파스타 목살스테이크,2020년 1월 25일,1
39,로니로티,버블버블,음식 맛있어요 얻어먹어서 두배로 맛있었네요. 웨이팅이 있을 수 있어요,점심식사 데이트 기념일 가족외식 고급스러운 가성비좋은 푸짐한 시끌벅적한,게살파스타 갈릭삼겹살스테이크,2019년 9월 25일,1
40,로니로티,콩떡,메뉴들이 양도 많고 맛있어요 특히 오이스터 파스타가 맛있었어요,점심식사 저녁식사 식사모임 데이트 기념일 가성비좋은 예쁜 깔끔한,오이스터 파스타,2022년 1월 5일,1
41,로니로티,zInI,파스타 너무너무 맛있어용♥️ 위치도 찾기 쉽고 가게도 넓어요,저녁식사,베이컨 까르보나라 해산물 토마토 스파게티,2022년 7월 2일,1
42,로니로티,유자짱,"건대 파스타집 검색하면 가장 먼저 뜨는 집인데 맛집은 아닙니다. 목살스테이크샐러드는 서가앤쿡 거랑 비슷하다고 보시면 돼요! 특히 샐러드는 정말 비슷하고 스테이크 굽기가 여기가 좀 덜 구워져서 나오는 것 같아요. 게살로제파스타는 진짜 게살이 들어있을 줄 알았는데 게맛살이 들어있더라구요. 맛살... 전 맛살 좋아해서 괜찮았지만 그냥 좀 웃겼어요 ㅋㅋ소스는 시판소스 맛이구요. 저처럼 아무거나 잘 드시고, 양식 돈 많이 안주고 배부르게 드시고 싶으신 분들 가시면 좋은 곳 이에요. 웨이팅 있었는데 그럴 가치가 있는지는 잘 모르겠어요!",점심식사 저녁식사 데이트 가족외식 푸짐한 깔끔한,목살스테이크샐러드 게살로제파스타,2019년 9월 15일,1
43,로니로티,hyeokly,평범한 양식집,점심식사 저녁식사 캐주얼한,베이컨 까르보나라 해산물 까르보나라,2023년 9월 11일,1
44,로니로티,Ji-won Kim,하프하프가 좋아요! 양이 진짜 많아서 하프하프가 딱입니다. 스테이크 꼭 드셔보세요. 맛나요,,,2017년 1월 30일,1
45,로니로티,Kim MyoungGyu,"정말 전반적으로 괜찮았습니다. 특히 가격대가 마음에 들더라구요. 그렇게 비싸지 않은 편인데, 점심할인까지 있다는게 신기했습니다. 다만 늦게가면 줄서야할 것 같네요.",점심식사 저녁식사 식사모임 데이트 푸짐한 예쁜,파스타 스테이크 리조또,2018년 1월 23일,1
46,로니로티,wonnie,어쩌다 주방쪽에 앉았는데 박스나 물건들이 너무 좀 너저분하게 늘어져 있어서 보기 좀 안좋았어요. 그냥 저렴하게 한 끼 먹기에는 괜찮은거 같아요.,점심식사 저녁식사 데이트 남자끼리 여자끼리 캐주얼한 가성비좋은 가성비좋은 현장대기필요,,2017년 7월 12일,1
47,로니로티,NGP,"양이 무식하다 싶을 정도로 많습니다.  하프메뉴가 있는데, 그걸 시키면 웬만한 가게 1인분 양입니다. 진짜입니다.... 양이 엄청나게 많고..... 하프메뉴가 아닌 일반 메뉴를 시키면 웬만한 가게 1.5~2인분이라고 보시면 됩니다. 엄청나게 많습니다. 손님들 대부분이 잘 모르고 시켰다가 음식을 많이 많이 남깁니다.  웨이팅이 많이 깁니다. 가성비가 매우 좋은 식당이라서, 손님이 늘 많고 바쁜 시간대에 가면 2~30분은 기본적으로 기다려야 합니다.",,,2016년 9월 16일,1
48,로니로티,미식파이터,도대체 왜 이곳이 상위노출이 되는지 납득하기 힘들 정도로 평가가 안 좋은 곳 입니다.,점심식사 시끌벅적한,오이스터소스리조또,2018년 10월 2일,1
49,로니로티,양준영,가성비가 좋아요. 맛은 평근은 해요. 기다려서 먹을정도는 아니라고 생각해요,점심식사 저녁식사 식사모임 캐주얼한 가성비좋은 시끌벅적한,크림파스타 로제파스타 샐러드,2018년 8월 11일,1
50,로니로티,yulia,친구들이랑 자주 가는 곳인데 가격도 적당하고 양도 많아서 참 좋아요,저녁식사 데이트 가성비좋은,김치필라프 목살스테이크 에이드,2019년 8월 30일,1
51,로니로티,뇸뇸뇸,건대에서 적당한가격으로 연인들이 데이트하기에 적절한 좋은맛과 분위기가 있는곳,저녁식사 데이트 캐주얼한 시끌벅적한,목살스테이크셀러드,2017년 5월 30일,1
52,로니로티,맛집투럭ㄱㄱㄱㄱㄱ하럭ㄱㄱㄱ,맛있고 분위기도 괜찮아요 데이트 할 때 딱이에요!,,,2016년 10월 10일,1
53,로니로티,Geonhee Cho,,,,2017년 2월 4일,1
54,로니로티,청인지,,,,2016년 12월 28일,1
55,로니로티,잉여,,,,2016년 10월 18일,1
0,Duff Town,푸르르게,술 먹기 정말 좋은 곳!! 가격대도 합리적이고 안주도 굿이에요,데이트 격식있는 가성비좋은,전체메뉴,2월 17일,1
1,Duff Town,참새짹짹,아주 아주 분위기 좋은 칵테일 가게에요. 지나가다 외관이 너무 예뻐서 들어갔는데 손님들도 많았어요. 다른 메뉴들은 안먹어봤는데 스테이크는 조금 질겼어요.ㅠㅠ 그래도 가성비 좋습니다! 저렴한 가격이 스테이크를 먹었어요.,저녁식사 데이트 기념일 고급스러운 격식있는 가성비좋은 조용한 예쁜 깔끔한 이국적/이색적 주차불가,등심스테이크 칵테일,2022년 1월 4일,1
0,건대맥주창고,구름구름,+건대한복판에서 그나마 조용 +흑맥주 종류다 별로 없었음 +하이네켄 생맥 있어서 좋았음 +안주 필수 아니라 좋음,술모임 조용한,하이네켄 생맥주,2019년 11월 21일,1
1,건대맥주창고,대디,"내가 먹고싶은 스타우트, 하얼빈 없어서 아쉬웠음 그래도 맛있었음",술모임 데이트 지역주민이 찾는,에스텔라 하이네켄,2018년 2월 10일,1
2,건대맥주창고,우유,노래 소리 적당하고 깔끔하고 괜찬은듯 ㅋㅋ 맥주상태도 쏘쏘,데이트 서민적인,맥주,2018년 2월 9일,1
0,Mix Lounge Bar,파랑,"맛은 보통 칵테일바 정도인데 서비스나 프레첼 리필을 잘해주십니다. 메뉴가 다양하게 많고, 논알콜도 있어 편하게 오기 좋을 것 같습니다.",저녁식사 술모임 회식 데이트 캐주얼한 가성비좋은 깔끔한,깔루아밀크 데낄라선라이즈 애프리코트 바카디모히또,2021년 11월 3일,1
0,사시미,꼬망꽁치,같이 나오는 스키다시조 좋고 방어도 맛있어요. 네명이서 먹었는데 양이 정말 많네요. 튀김이나 낙지도 맛있고 재방문의사 있습니다,저녁식사 식사모임 접대 회식 가족외식 가성비좋은 푸짐한 시끌벅적한 대형룸,대광어 숙성회,2월 25일,1
1,사시미,희용쓰,물회 매운탕 맛있어용 회도 싱싱하고 친절하세요!!루프탑도 있고 좋습니다,저녁식사 술모임 데이트 기념일 숨은맛집 지역주민이찾는 캐주얼한,광어회/연어회 매운탕 물회,2023년 6월 13일,1
2,사시미,룰루랄라,맛있어요 음식은! 근데 룸이 너무시끄러웠습니다ㅜㅜ 3층으로되어있아요,데이트,모듬회,2022년 8월 9일,1
3,사시미,개미똔뚠,회와 쓰끼가 맛있는집이에요! 가게내부는 약간시끄러운편이에요!,술모임 시끌벅적한,생선회세트 대,2022년 7월 21일,1
4,사시미,우니니남친,육회 오랜만에 시켜먹었는데 꿀맛이었습니다. 또 주문할게요!,배달 숨은맛집 무료주차,육회,2022년 3월 11일,1
0,디노노가리술집,호잇호잇,직장인과 대학생들이 엄청 많이 찾는 곳 가격이 저렴해요,술모임 시끌벅적한,버터오징어 생맥주,2020년 7월 2일,1
0,한사바리,히봉2,오픈 하자마자 들어갔는데 금방 만석이 되더라구요 모든 음식 신성하고 맛있습니다!,술모임 지역주민이찾는 조용한 서민적인,생연어회16p/11p 한우 육회,3월 23일,1
1,한사바리,mandulover,매장이 크지 않아서 아담하고 적당히 시끄러운 동네 술집입니다. 매장이 깔끔하고 사장님이 친절하셨어요. 연어 서비스도 주시고 안주도 가격 대비 양이 많아서 재방문 의사 있어요.,저녁식사 술모임 데이트 숨은맛집 서민적인 캐주얼한 가성비좋은 지역주민이 찾는,생연어회 간장보쌈,2020년 2월 19일,1
0,해남닭집,Aiden,"건대입구역에서 10~15분 거리에 위치한 치킨 가게입니다.  주문과 동시에 치킨을 바로 튀겨주시는데, 사람이 많은 날에는 치킨 나오는데까지 시간이 쫌 오래 걸리더라구요.  맛은 옛날 통닭을 좋아하시는 분들이 좋아하실 것 같은 그런 맛이에요. 후라이드는 바삭 + 담백하고 양념은 바삭 + 달달합니다. 생맥주랑 같이 먹어야 할 것 같은 맛이에요.  양념은 맛있어서 사진찍는걸 깜빡했습니다😅",저녁식사 식사모임 서민적인 캐주얼한 가성비좋은 시끌벅적한 지역주민이찾는 푸짐한 주차불가,후라이드치킨 양념치킨,2023년 8월 4일,1
1,해남닭집,mkjung486,어린시절 먹었던 추억의맛인데 정말 너무 맛있었어요. 야채샐러드 꼭 추가해서 맥주랑 먹으면 꿀맛입니다. 다음에 번데기탕도 먹으러갈게요.,저녁식사 숨은맛집 서민적인,후라이드치킨 야채샐러드,2월 26일,1
2,해남닭집,공릉방어찜,근처에 브랜드있는 치킨만 먹엇엇다가 해남닭집 유명하다고해서 먹엇는데 진짜 맛잇네요 레트로감성 쩌네요  자주올것같아요,데이트 술모임 회식 숨은맛집 서민적인 지역주민이찾는,후라이드치킨 야채샐러드,2월 26일,1
3,해남닭집,꺄울콩,오래기다려서 배고파서 힘들었지만 치킨은 맛있어요 완전 옛날치킨 느낌,저녁식사 식사모임 술모임 데이트 가족외식 간식 숨은맛집 서민적인 가성비좋은 시끌벅적한 지역주민이찾는,반반치킨 야채샐러드,1시간 전,1
4,해남닭집,해밭,저렴하고 맛있어요 주차는 많이 어렵습니다 워낙 골목길 안이라서요,술모임 데이트 서민적인 주차불가,치킨,2023년 1월 1일,1
5,해남닭집,오잉,누군가에게 추억의 맛이라고 함 고소하고 맛있는 튀김옷에 건대다운 물가 ㅜㅜ,술모임 간식 서민적인 캐주얼한 지역주민이찾는,반반치킨,2022년 5월 4일,1
0,바인,콩콩콩888,시끌벅적하고 복잡한 건대에서 우연히 들어갔는데 대만족했던 다이닝바 전문바텐더랑 소믈리에분이 계셔서 취향대로 그때그때 느낌에 맞게 칵테일 만들어주심. 친구들하고 분위기내기 너무 좋고 음식들도 다채로운 재료들 사용하는 정성있는 음식들임. 전체적으로 다 성공적이었뚬 재방문의사 100%,저녁식사 술모임 혼술 접대 데이트 기념일 조용한 예쁜 깔끔한 분위기좋은 바 자리,한방오리스테이크 멜론리코타 다수의 칵테일 매콤조개파스타,2023년 7월 10일,1
1,바인,주니쭌,들어가자마자 조명과 인테리어가 너무 이쁘고 아기자기한 소품들과 테이블이 잘 어울리게 배치되있어서 사진도 잘나오면서 음식맛과 와인&칵테일은 기본으로 훌륭합니다. 데이트 코스로도 좋고 혼술하시는분들도 바텐더님과 소믈리에님이 추천잘해주시니 믿고 드세요:),저녁식사 술모임 혼술 데이트 기념일 고급스러운 가성비좋은 예쁜 깔끔한,오리스테이크 멜론&유자리코타,2023년 7월 4일,1
2,바인,크아아아앙,"청담동에 있을법한 퀄리티와 분의기의 장소가 건대에도 생겼네요. 가격은 건대의 가격대 조금 있는곳 수준이지만 퀄리티는 청담동 이상이라 생각될 정도입니다. 모든 음식이 전부 하나하나 정성이 들어가고 다양한 재료들을 사용한게 느껴집니다. 와인 리스트와 가격도 좋은 편이고, 칵테일도 기본 기주를 좋은걸 쓰시는거 같아요. 취향에 맞게 칵테일이랑 와인 추천도 전문적으로 해주십니다 ㅎㅎ",저녁식사 식사모임 술모임 혼밥 혼술 데이트 기념일 숨은맛집 고급스러운 격식있는 조용한 예쁜 깔끔한,"버섯 살러드 한방 오리스테이크 봄나물과 들깨 베샤멜, 들기름 두부구이 트러플 버섯크림 감자뇨끼",2023년 5월 27일,1
3,바인,아델,그냥 바라기 보다는 주류와 음식문화를 향음할 수 있는 곳이에요. 위치는 좋지만 너무 영한 식당들만 있는 건대에 이런 다이닝바가 생긴 덕분에 미팅하거나 친구들이랑 자주가고있어요. 음식이 맛있고 와인도 소물리에 사장님이 잘 설명해 주시고 칵테일도 전문적인 곳. 주말 런치로도 좋은 곳.,점심식사 저녁식사 식사모임 데이트 기념일 숨은맛집 고급스러운 예쁜 깔끔한 이국적/이색적,한방오리스테이크 소고기깻잎타르타르 트러플크림파스타 감자뇨끼 조개파스타 라자냐 두부요리,2023년 5월 19일,1
4,바인,가축,"분위기에 취해, 술에 취해, 음식에 취해 머무는곳. 음식은 말할것도 없고 술을 잘 몰라도 된다. 바텐더 출신 남사장님과 소믈리에 여사장님이 술 특징 설명해주면서 맞춤형으로 추천해주신다. 타르타르 존맛. 또먹으러 가야지",술모임 데이트 기념일 숨은맛집 캐주얼한 조용한 예쁜 깔끔한,소고기 깻잎 타르타르 초리조딥과 치아바타 조개파스타,2023년 7월 22일,1
5,바인,콩조앤,기념일 2차로 가서 맛있게 즐기고 왔습니다. 와인 추천도 잘 해주시고 특히 칵테일이 전문적이에요. 1차를 먹고가서 조개파스타만 시켰는데 너무 맛있어서 처음부터 여기 올걸 그랬다고 했네요. 다음에 다른 메뉴들도 먹으로 오겠습니다 ! 번창하세요!,식사모임 저녁식사 술모임 기념일 데이트 가족외식 회식 숨은맛집 고급스러운 이국적/이색적 예쁜 내부화장실,조개 파스타 칵테일 와인,1월 17일,1
6,바인,솥귀,건대에서 볼 수 없는 분위기 좋고 퀄리티 높은 BAR 데이트하기 좋은 장소 건대같지 않은 조용한 분위기 칵테일 전문 바텐더와 와인 전문 소믈리에 가 있어서 추천받기 좋았음 칵테일 전문적이고 요리도 다 좋음. 특히 파스타 맛있었음,점심식사 저녁식사 식사모임 술모임 혼술 데이트 기념일 가족외식 숨은맛집 캐주얼한 고급스러운 격식있는 조용한 예쁜 깔끔한 푸짐한 가성비좋은 주차불가,수비드 된장 목살 조개 파스타 침실의 여왕 네그로니 부라타치즈 샐러드,2023년 5월 17일,1
7,바인,글쎄뭐라할까,전체적으로 화이트 톤으로 깨끗하고 위생상태가 좋아 보임. 직원분들이 밝고 친절해요. 다트가 있어요. 2~4명이서 놀러가면 좋아요. 시간가는 줄 모릅니다 ㅎㅎ,저녁식사 술모임 혼술 혼밥 데이트 숨은맛집 조용한 깔끔한 예쁜,버섯 샐러드 트리플 감자크림 뇨끼 조개 파스타 올드패션드 칵테일 김렛,2023년 7월 5일,1
8,바인,포동포도,지하라 어두울꺼라고 생각했는데 전체적으로 베이지톤에 차분하고 밝은 분위기라 놀랐음. 음식도 맛있고 칵테일도 바텐더분이 전문적으로 추천해주셔서 내 입맛에 딱 맞는 칵테일만 마실 수 있었음. 소믈리에분도 계셔서 다음 방문때는 메뉴에 와인페어링을 즐겨보려고 함. 아주 만족스러운 식사였음.,저녁식사 식사모임 술모임 혼밥 혼술 회식 데이트 기념일 가족외식 숨은맛집 캐주얼한 고급스러운 격식있는 가성비좋은 조용한 깔끔한 콜키지,소고기깻잎타르타르 한방 오리스테이크,2023년 5월 18일,1
9,바인,gggeun,건대에 이런곳이 있다는게 신기하고 덕분에 건대 아닌 고급진 곳에서 맛있는 음식과 칵테일을 즐겼다. 건대에 이런곳이 많이 생기길,저녁식사 혼술 데이트 기념일 고급스러운 격식있는 깔끔한 조용한 숨은맛집,"봄나물과 들께 베샤멜, 들기름 두부구이 수제자몽 리코타치즈와 봄나물샐러드",2023년 4월 13일,1
0,사거리식당,혜또먹,곱도리탕에 주먹밥까지 시켜서 그런 건지 모르겠지만 정말 배불렀어요 국물도 맛있고 괜찮았습니당,저녁식사 식사모임 술모임 가족외식 시끌벅적한 무료주차,세트 1 곱도리탕 + 주먹밥or볶음밥,2023년 12월 9일,1
