,rst_name,user_name,review_text,u_rst_tag,ate_menus,date,platform
1,육성회비,은애,워낙 입소문이 난 곳이라 한 번 방문해 봤어요. 떡꼬치가 맛있다길래 주문해 봤는데 그냥... 생각했던 것보다는 별로더라고요. 떡이 아주 작게 잘라졌는데 하나씩 먹기엔 좀 너무 작았던 것 같아요. 숟가락으로 퍼먹는 게 나을 것 같았네요. 육회가 나빴던 건 아니지만 육사시미로 먹을 걸 그랬나 싶은 마음도 들어요. 맛이 없었던 건 아니지만 기대에 비해서는 별로였어요. 아쉽네요.,저녁식사 혼술 시끌벅적한,한우 육회 떡꼬치 스지오뎅탕,2022년 5월 16일,1
2,육성회비,먹죽귀,건대에서 가성비와 맛이 정말 좋았던 육사시미맛집 육성회비에서 다녀 왔습니다🤗 ⠀ 친구와 2차로 방문한곳인데 건대 맛의거리 보다는 다소 떨어진 위치에 있어 친구와 널널하게 입장 할 수 있겠다고 생각했는데 반전이..🤭 ⠀ 늦은시간인 8시쯤 입장했는데도 불구하고 매장은 만석이였고 젊은분들이 많아 굉장히 활기찬 분위기 매장이였고 조용히 한잔 하시려는 분들은…..😅😅 ⠀ 들어가자마자 메뉴판을 봤는데 아니 이렇게 저렴한 육회와 육사시미는 처음 봤어요🥰 ⠀ 사이드메뉴는 육회나 육사시미를 주문해야 주문이 가능했고 당일한정인 육사시미와 하이볼을 주문☺️ ⠀ 가격이 워낙 저렴해서 양이적거나 신선하지 않을까 걱정했는데 웬걸 완전 신선하고 양도 푸짐했어요👍 ⠀ 붐베이 하이볼도 말도 안되게 저렴해서 5잔이나 먹었는데 이벤트 중이라 붐베이하이볼 잔까지 득템😁 ⠀ 열심히 육사시미와 하이볼을 즐기는데 너무 귀엽고 예쁜 토끼가 올라간 계란찜을 가져다 주셨는데 아까워서 정말 구경만 하다가 마지막에 먹었어요😢 ⠀ 전체적으로 친구들과 기분좋게 떠들면서 맛있고 가성비 좋게 육사시미를 즐기기 좋은 곳이였습니다🥩,저녁식사 술모임 혼술 데이트 숨은맛집 가성비좋은 시끌벅적한,육사시미,2021년 11월 8일,1
3,육성회비,가성비살인마,예전에 건대살 때 자주가다가 이사하고 오랜만에 갔더니 3시간 시간 제한이 생겼더라고요.. 쩝ㅠ;  주택가에 있어서 처음이시면 지도 잘 보고 가야함. 내부가 어둡고 시끄러워서 조용한 분위기를 찾는다면 비추.  기본 육회나 육사시미 시키고 나면 추가 안주들이 저렴하기 때문에 안주 금액 부담이 없다. 안주는 대부분 다 맛있는 편.  개인적으로는 육회가 더 맛있음,술모임 서민적인 시끌벅적한 지역주민이찾는,육회 해장라면 크림새우,2021년 6월 23일,1
4,육성회비,유히,"건대의 숨은 육회 맛집. 먹자골목에서 꽤 깊이 들어가야합니다. 육회 양념이 많이 달지 않고 과하지 않으며, 육질이 신선합니다. 무료로 내어주는 차완무시도 훌륭. 심지어 가격까지 저렴하네요. 자리가 협소한 것이 흠이지만 생각보다 시끄럽지 않아 감내할만 했습니다. 사시미 보다는 육회를 추천!",술모임 데이트 숨은맛집 서민적인 시끌벅적한,육회 육사시미 치즈계란말이,2020년 2월 15일,1
5,육성회비,jj,"예전처럼 귀여운 계란찜은 안주시는 것 같아요. 대신 아이셔 이슬이 있는데 일행이 좋아했어요! 육회, 육사시미는 맛있었는데 떡꼬치는 꼬치가 아니고 팥죽 새알심 크기만한 떡을 튀겨서 토마토 소스 뿌려서 주시는데 그럭저럭입니다. 하이볼은 다음에 맛보는 걸로..",저녁식사 술모임 데이트 시끌벅적한,한우 육회 한우 육사시미 떡꼬치 소고기 해장라면+햇반2,2022년 7월 11일,1
6,육성회비,hange,육회 육사시미가 대표메뉴이고 해장라면이 별미라기에 주문했어요 결론은 너무 맛있어요! 라면 꼭 드셔보세요!!,술모임 캐주얼한 지역주민이찾는,육회 육사시미 소고기 해장라면,2023년 2월 15일,1
7,육성회비,진이,"육회 맛있음! 소주 많이 마시면 할인도 된다는데 다른 술 시켜서 모르겠음, 안주가 대체로 맛있는 편임, 음악을 크게 틀어서 사람 많아지면 대화하는 데 조금 어려움 있음",저녁식사 술모임 데이트 기념일 캐주얼한,육회 국물떡볶이,2021년 6월 23일,1
8,육성회비,matziplist,웨이팅해서 먹을 맛인가. 육회에서 나는 냄시... 그리고 바 자리 앉으면 심한 소잡내...? 라면 끓이느라 그 냄새같은데 토할뻔 ㅜㅠ,술모임 가성비좋은 시끌벅적한,육회,2020년 3월 14일,1
9,육성회비,Daeyoung Kim,육회 맛있어요 육회는 무조건 주문해야해요 ㅎ 주택가 가운데있어서 지나치기쉬우니간판 잘봐야해요 안은 어두워요 그래서 미남미녀 ㅎ,술모임 데이트 숨은맛집 시끌벅적한,육회,2019년 7월 3일,1
10,육성회비,CM,"전체적으로 깔끔한 분위기였고, 음식도 정갈하게 나와서 잘 먹고 갔습니당",저녁식사 술모임 혼술 숨은맛집 시끌벅적한 깔끔한,육사시미 육회 사골만두탕,2019년 7월 22일,1
11,육성회비,OwO,여기 너무 맛있고 분위기도 좋아요ㅠ 가성비도 짱짱! 조용하게 소주마시며 담소나누고 싶을때 가면 좋을것같아요~,,,2017년 2월 5일,1
12,육성회비,JongIk Chris Park,,,,2016년 9월 18일,1
13,육성회비,청량리고든,,,,2016년 8월 8일,1
0,제주올레포차 본점 숨비소리,안사너,요리가 맛있는 제주포차입니다. 일단 사장님이 상당히 무섭게 생기셨는데 그 외모와 달리 너무 친절하시고 서비스도 잘 챙겨주시는 친절함이 돋보이는 집입니다.  요리도 굉장히 맛있습니다. 추천메뉴가 있다기보단 무슨 메뉴를 시켜도 후회없을겁니다!,술모임 캐주얼한 지역주민이 찾는,물회,2019년 7월 29일,1
1,제주올레포차 본점 숨비소리,Hyo Jin Jeong,서울에서 쉽게 맛보기 힘든 제주해산물이 있다는 것만으로도 좋았습니다. 사장님이 서비스도 주셨네요,저녁식사 모임 남자끼리 이색 독특한 시끌벅적한 캐주얼한,,2017년 7월 19일,1
2,제주올레포차 본점 숨비소리,미식파이터,"제주도 음식이 그리울때 들려서, 몸국과 한라산 한 잔 하기에 좋은 술집입니다.",저녁식사 술모임 회식 데이트 서민적인 가성비좋은 시끌벅적한 이국적/이색적 야외좌석(테라스),몸국 고갈비 말고기육회,2018년 9월 21일,1
0,아일랜드유끼펍,리턴오브장금이,피맥을 할 수 있는 술집입니다. 피자 말고도 다른 안주들이 많습니다. 소주보단 맥주 먹을 때 방문해볼만합니다.,술모임 데이트 간식 시끌벅적한 이국적/이색적,페퍼로니피자 레드락,2020년 10월 19일,1
0,설맥 건대점,만두만두,축구나 경기보기에 좋은 곳. 큰 스크린이 있다. 맥주 시원하니 맛있고 먹태도 무난,술모임 회식 시끌벅적한,설맥 눈꽃맥주 버터먹은 먹태,2023년 9월 30일,1
0,짱구야학교가자 건대점,bibi,건대 골목에 위치한 짱구야 학교가자 술집 내부는 학교컨셉이랑 포차컨셉 두가지로 나뉘어져 있고 국물닭발이 유명한 술집이에요 사장님도 친절하시고 메뉴가 다 맛있어요 ㅎㅎ,저녁식사 술모임 숨은맛집 서민적인 이국적/이색적,국물닭발 콘치즈,2020년 12월 6일,1
0,심마니,타로맛만두,막걸리를 마실 수 있는 한국적인 분위기의 술집입니다~ 그래서 그런지 외국인이 많았음! 파전은 맛났으나 돼지불고기?는 잡내가 있어 다 못 먹었습니다ㅠ,술모임 데이트 서민적인 캐주얼한,막걸리 제육볶음과 두부 해물부추전,2023년 11월 9일,1
1,심마니,만두맛타로,생각보다 금액이 싼것같으면서도 비싼곳 전이랑 막걸리는 맛이 좋았지만 제육볶음은 냉동된지 오래된 돼지고기인지 누린내가 심하고 짠맛이 강했읍니다.,술모임 서민적인 주차불가,막걸리 제육볶음과 두부 해물부추전,2023년 10월 26일,1
2,심마니,Aiden,"건대입구역에서 5~10분 정도 거리에 있는 술집입니다.  메인 안주를 한 번 주문하면, 파전이랑 부추전을 장당 4800원이라는 저렴한 가격으로 추가 주문할 수 있어서 학생들 사이에서 인기가 많습니다.  얼마 전에 자리를 옮긴 것 같은데 이전에 있던 곳보다는 전체적으로 내부가 살짝 밝아진 느낌이 있지만, 그래도 여전히 주막 느낌이 물씬 풍겨서 전이랑 막걸리 먹기에 딱 좋은 것 같아요.  감자전은 강원도에서 먹는 감자전이랑은 달리, 채 썬 감자로 전을 부친 느낌이었습니다. 그래서 한 입 먹으면 입안에서 채 썬 감자가 고스란히 느껴지는데, 지금까지 먹었던 쫀득쫀득한 감자전이랑은 식감이 전혀 달라서 신기했지만 맛있게 잘 먹었습니다.  해물파전은 오징어가 정말 많이 들어있었습니다. 지인들이 자리를 비운 사이에 남은 2명이서 오징어만 쏙쏙 골라 먹었는데도 오징어가 남아있었을 정도로 많았어요. 해물파전은 적극 추천합니다.  사실 전집에서는 막걸리를 먹었어야 했지만, 이번에는 과일 소주를 먹었습니다.  레몬 소주, 포도 소주, 사과 소주 이렇게 3가지를 먹었는데, 개인적으로는 포도 > 사과 > 레몬 순서로 맛있었습니다. 맛있어서 꿀꺽꿀꺽 마시다가는 길바닥에서 잘 수도 있으니 조심하세요.  건대에서 전이랑 막걸리가 먹고 싶으신 분들에게 추천해요.",술모임 데이트 숨은맛집 서민적인 캐주얼한 가성비좋은 시끌벅적한 지역주민이찾는,해물파전 감자전 레몬소주 포도소주 사과소주,2023년 2월 20일,1
3,심마니,남용은,차음 문 열고 들어갔을때.. 이 가게는 후각으로 말했다  &quot;여기가 심마니다&quot;  나는 후각에 이끌린채 보이는 빈자리에 가 앉았다. 주변은 온통 내 또래로 보이는 사람들이 취해서 우갸우갸 하고 있었고  그 모습을 보고 이곳이 건대라는걸 새삼 실감했다  심마니가 주는 메뉴판을 받고 주문하는데 채 2분조차 걸맂 않았다 선택장애 커플인 우리는 주문을 빨리 했가며 기뻐했다  주문을 하고 주변 테이블을 둘러보는데 어떤 사람은 울고있고 어떤 사람은 세명이서 마시다가 한명이 화장실을 가니 둘이 어색어색하고 있고  그런 익숙한 모습에 나는 마치 이곳이 내 동기가 하는 가게인것 마냥 이곳을 널리 알리기로 결심했다.  서비스 죠아요 맛도 죠아요 가격도 착해요,저녁식사 데이트 모임 남자끼리 여자끼리 시끌벅적한 허름한 오래된집 복고풍 토속적인 이국적/이색적 젊은사람이많은 새벽까지 2층,,2017년 7월 29일,1
4,심마니,youandme,옛날 주막에서 술 마시는 기분이 들어요ㅎㅎ어두운 조명이라 편안해서 얘기하기 좋은 분위기입니다 시켰던 전들은 평범했어요 막걸리는 주전자에 나오는데 완전 시원합니당 과일소주는 소주가 넘 적게 들어간건지 음료수 맛이 나네요,술모임 회식 데이트 서민적인 캐주얼한 시끌벅적한 이국적/이색적 지역주민이 찾는,심마니전 부추전 막걸리,2019년 8월 4일,1
5,심마니,동키몽,건대 막걸리하면 나오는 곳  맛 = 기본적으로 맛을 보유했거니와 가격도 저렴한 곳. 건대에서 오래 버티는데 이유가 있다.  분위기 = 자유롭게 떠들고 먹는 곳  총평 = 막걸리라면 여기지!,데이트 캐주얼한,해물파전,2019년 10월 12일,1
6,심마니,신난다리,누룽지동동주 완전 맛있다. 살얼음때문에 아주 시원하고 좋았다. 파전 가격은 조금 비쌌지만 맛있었고 분위기도 친구들과 떠들기 괜찮았다. 요구르트 소주는 그냥 요구르트맛이어서 돈아깝.,술모임 조용한,누룽지동동주 해물파전,2018년 8월 19일,1
7,심마니,녹이다,조명이 붉고 어두침침하다. 깔끔한 느낌은 아니다. 누룽지 동동주는 맛있다. 해물부추파전이나 기본안주는 좀 부실한 느낌이다. 가볍고 시끌벅적하게 한잔 하기 좋은 곳!,술모임 서민적인 시끌벅적한,누룽지동동주 해물부추전,2018년 3월 1일,1
8,심마니,마싯눈고,이런데는 맛보다 분위기인듯~ 막걸리 동동주 마시기 좋은 옛날 주막같은 느낌 ㅎㅎ 1000원 내면 바가지에 낙서할 수 있음,술모임 서민적인 시끌벅적한,누룽지동동주 해물부추전,2018년 4월 3일,1
9,심마니,식사에미친사람,"막걸리가 맛잇고 양이 많다,, 전도 맛있는데 가격이 와안전 싼건 아니니까 그냥 평범한듯 ,, 흡연할수 잇는 구역이 문앞이라 흡연자는 조은데 알바생은 쉬러하는거같앗움,,ㅠ",술모임 회식 서민적인 시끌벅적한,김치전 막걸리,2018년 8월 28일,1
0,엘루이 비스트로,룰룰,건대 루프탑 칵테일바. 휴양지 온 기분이에요~ 예쁘다고해서 도화 시켰는데 기대보다 더 맛있었어요. 복숭아 맛인데 피치크러쉬보다 더 맛있네용,저녁식사 술모임 데이트 캐주얼한 시끌벅적한 이국적/이색적,도화,2020년 7월 9일,1
1,엘루이 비스트로,최다혜,,술모임 접대 숨은맛집 이국적/이색적,cocktail,2023년 2월 16일,1
0,서울230,먹탐방,가게 분위기가 정말 좋았고 인테리어도 독특해서 데이트 코스로 추천합니다! 카페 겸 술집이라서 언제 가든 좋을 것 같아요! 시그니처 메뉴들도 비싸지 않고 가성비 좋은 건대의 숨은 술집입니다!,술모임 저녁식사 회식 기념일 데이트 숨은맛집 가성비좋은 예쁜 깔끔한 캐주얼한,토마토 해산물 스튜 & 바게트,2월 7일,1
0,하노이맥주밤거리 건대점,이구아날,테마가 있는 술집이라 좋았고 안주도 다양하고 맛있었음 또 가볼듯,저녁식사 술모임 데이트 기념일 캐주얼한 예쁜 깔끔한 이국적/이색적 경관/야경이좋은 지역주민이찾는,직화모듬꼬치 생맥주,2023년 9월 19일,1
1,하노이맥주밤거리 건대점,해삐,직원분이 친절하였고 맥주가 시원하니 정말 맛있어요 메뉴가격이 다 착한데 맛도있었습니다,저녁식사 술모임 캐주얼한 시끌벅적한 이국적/이색적 개별룸,하노이 분짜 꼬지어묵김치우동,2023년 7월 15일,1
0,하루,나무늘보,간단하게 하이볼하기 좋은 곳입니다 밀푀유나베랑 다른 메뉴들 맛 괜찮습니다,술모임 시끌벅적한,밀푀유나베,2023년 12월 3일,1
1,하루,초록숲길,전반적으로 메뉴들 맛 괜찮음 자리간격이 좁은 편이라 시끌벅적함,술모임 시끌벅적한,아보카도명란구이 치킨가라아게,2023년 11월 10일,1
0,타스 더안주셀렉트샵,그냥오늘하루,"""기분내기 좋은 밥집이자 술집""  메뉴판 따로 없이 QR로 찍고 보면 된다. 내부는 전형적인 술집 겸 주방이 잘보이는 구조이다 완전한 오픈키친은 아니지만 요리사가 뭘 하는지정도는 충분히 볼 수 있다.  맛은 괜찮다. 상허관과 경영대에서 5분컷이면 가는 집에 엄청 훌륭한 집은 아니어도 기분내기 좋은 음식을 하는 곳이랄까.  맛은 장어덮밥 스타일에서 도미테이스트가 첨가된 느낌이다.  다른 메뉴 먹으러 한번쯤 더 가보고싶은데  벌써 종강이 다가오는게 흠",술모임 캐주얼한,도미뱃살(점심),2023년 12월 13일,1
0,일양전,미식가단,사장님이 서비스도 많이 주시고 너무 좋아요!  더 자세한 후기는 [미식가 단의 점수는] 검색 후 네이버블로그 놀러오세요😊,저녁식사 식사모임 술모임 혼술 접대 회식 데이트 기념일 가성비좋은 지역주민이찾는,계절사시미 小 고등어 봉초밥 스카치 에그 바지락술찜,3월 6일,1
1,일양전,에그,분위기도 좋고 친절하고 맛잇음 아쉬웟던건 바지락 술찜먹고 면추가했을때 너무짰음,술모임 숨은맛집 서민적인,모듬사시미 中 아귀간 전복 내장 파스타,1월 30일,1
2,일양전,hudieboy,일식 양식 퓨전 할 것 없이 다 맛있는데다 사장님도 너무 친절하세요,술모임 회식 데이트 캐주얼한 깔끔한,스카치 에그 전복 내장 파스타 고등어 봉초밥 모듬사시미 中,2월 3일,1
3,일양전,냔뉴딘,고등어회는 정말 신선하고 맛있었어요! 파스타에 바지락도 충분히 넣어주셔서 잘먹었습니당,술모임 데이트 캐주얼한 가성비좋은 깔끔한 주차불가,바지락볶음파스타 고등어회,2023년 1월 29일,1
0,폼프리츠,bled,가게가 좀 작고 유명해서 사람들이 많지만 간술하기에 딱 좋은 곳이에요~~ 바닐라맥주 꼭 드시길!!!!!!!,술모임 시끌벅적한,감자튀김 S 바닐라맥주,2023년 12월 29일,1
0,육회한연어,복덩이냠냠박사,매장이 생각보다 넓어서 좋아요 먹고 싶은걸 골라서 먹을 수 있어서 좋고 연어도 맛있게 먹었어요,저녁식사 시끌벅적한 지역주민이찾는,연어+간장새우,7시간 전,1
1,육회한연어,브로콜리,육회가 신선하고 맛있었어요. 육회가 무한리필이라니 신기함!!,식사모임 술모임 회식 서민적인 캐주얼한,무한육회(1인),2023년 2월 1일,1
2,육회한연어,련정,오랜만에 만난 친구랑 간 곳인데 육회랑 연어랑 둘 다 먹을 수 있어서 좋아요. 배불러서 리필을 많이 받지는 못했지만 맛있었습니다.,저녁식사 술모임 데이트 깔끔한,육회무한리필 연어무한리필,2019년 9월 2일,1
3,육회한연어,스리,무한리필 안시키기엔 양이 적고 무한리필 시키기엔 거의 한접시 밖에 못먹어요,저녁식사 술모임 데이트 서민적인 푸짐한,연어,2022년 7월 19일,1
4,육회한연어,김지연,육회한연어. 육회가 깔끔하고 맛있고 소고기튀김도 맛나요!! 배달도 됨,저녁식사 술모임 혼술 접대 데이트 숨은맛집,연어 육회,2019년 1월 8일,1
5,육회한연어,리진,가성비 좋아요 혼술하기 딱 좋습니다. 맛도 좋고 종류가 많아요,배달,혼술세트,2021년 3월 25일,1
0,972Bar,식사에미친사람,"세번 갔읍니다., 무한리필이라 엄청 큰 퀄리리를 기대하지 않았는데 그래두 맛있읍니다,,, 물론 저는 단 칵테일이 좋아서 단 것만 시켰기 때무네.. 실패할 확률이 적었을지두... 글고 깔루아 밀크가 맛있습니다,, 땡땡비어같은데서 먹는 깔루아밀크와 차원이 다르더군요,, 제가 가장 좋았던 칵테일은 코스모 폴리탄입니다,,",술모임 데이트 기념일 가성비좋은,블루하와이 깔루아밀크 피치크러쉬 블루사파이어 코스모폴리탄,2018년 8월 28일,1
1,972Bar,강슬기,포토존이 많이 있었습니다 건대 맛집은 여기인 것 같아요 안 가보신 분들은 꼭 가보세요~~*,점심식사 저녁식사 식사모임 술모임 예쁜,와인,2021년 11월 11일,1
0,몽블랙,고붕,데낄라 썬라이즈 많이 알고있는 칵테일 맛입니다. 도수가 조금 쎕니다. 몽 블랙 이곳에서만 마실 수 있는 시그니처 칵테일입니다. 샹그리아와 비슷한 맛이 납니다. 맛있습니다. 복숭아 물담배 사실 이곳에 오는 목적은 물담배입니다. 복숭아향이 조금 약하긴 했으나 좋았습니다.  메뉴판에 칵테일에 대한 상세한 정보가 적혀있어 주문이 용이합니다. 가격은 적당합니다. 개별룸에다가 좌식으로 되어있어 매우 편합니다. 조용하고 잔잔한 분위기를 좋아하는 분께 추천합니다.,데이트 조용한 이국적/이색적 경관/야경이 좋은 개별룸,데낄라 썬라이즈 몽 블랙 복숭아 물담배,2020년 1월 18일,1
1,몽블랙,강몬지맘,안에 고양이 있어요! 회색고양이 돌아다녀요  2차로 갔는데 치즈만 계속 먹다가 배불러서 술도 남기고 옴..ㅜ  좌식칵테일바 여러군데 가봤는데 여기가 가장 프라이빗했어요 진짜 소리만 들리지 보이는건 다 칸막이 꽁꽁 쳐놔서 안보임 남자친구랑 오면 꽁냥꽁냥 할거 같아요  인테리어도 고양이 천국이예요 화장실도 그렇고 귀여워요,술모임 데이트 기념일 건대 칵테일 건대 물담배 예쁜 깔끔한 이국적/이색적 경관/야경이 좋은 지역주민이 찾는,물담배 2 추천해 준 와인 치즈플레이트,2019년 8월 3일,1
2,몽블랙,워킹뱀부,칵테일은 가격에 딱 적당한 수준의 맛이었고 나쁘지 않음. 각 테이블마다 거의 바닥에 앉는 좌식인게 좀 불편하지만 커튼쳐져있어서 사생활 보호가 될 듯 무엇보다 고양이가 있다 고양이가 너무 친근하고 낯가리지않고 쉽게 다가온다,술모임 캐주얼한 개별룸,과일카나페 준 벅,2019년 12월 8일,1
0,호호 닭발,유수진,국물닭발 맛은 아쉬웠습니다. 숯불닭발을 추천드릴게요.이맛도 저맛도 아니여서 별로였습니다.,술모임 서민적인 캐주얼한,"국물닭발(뼈,무뼈)",2023년 4월 9일,1
1,호호 닭발,angbutter,무뼈닭발 매우면서도 자꾸 당기는 맛이 진짜 맛있었음. 오돌뼈는 그냥 보통 오돌뼈 맛. 테이블 회전이 빨랐음. 대부분 1차 술자리 가지는것 같아보였음.,저녁식사 식사모임 술모임 데이트 서민적인 시끌벅적한 배달 야외좌석(테라스),무뼈닭발 오돌뼈 주먹밥,2018년 5월 5일,1
2,호호 닭발,김보현,무뼈닭발 제 인생닭발집...여긴 미쳤어요ㅠㅠㅠㅠ근데 오돌뼈는 좀 짰어요 담번엔 무뼈닭발만 조지려고욯ㅎㅎ알럽,저녁식사,무뼈닭발 오돌뼈,2017년 12월 21일,1
3,호호 닭발,이무지,무뼈닭발 존맛 정신없이 먹을수있음 먹다보면 서서히 매워지는 맛있는 매운맛 가끔 줄서야함,,,2016년 4월 20일,1
4,호호 닭발,Jeff,,,,2016년 12월 17일,1
0,평정원,민지,소고기 수육전골은 별로 입니다.고기에서 냄새나요..닭강정은 보통입니다.,,,1월 16일,1
0,노랑통닭 건대점,잘먹었쑤연,증말 바삭함이 기가막히는 노랑통닭은 소금까지 맛있다. 이번에 새로 출시된 청양치킨! 생각보다 맵지않고 유린기느낌의 달달한 맛인데 끝맛에 매콤함이 감싼다. 소스가 따로 나오니 후라이드 부먹 찍먹 입맛대로 취향대로 즐길수잇어 좋다,배달 지역주민이찾는,청양치킨,2023년 5월 16일,1
1,노랑통닭 건대점,고독한 혼밥러,뼈보단 순살이 먹기 편하고 좋네요ㅎㅎ 닭다리살이랑 닭가슴살이 섞여있어서 식감이 좀 풍부하고 좋았어요~,배달 서민적인 푸짐한,엄청 큰 반반치킨(후/양)(뼈/순살),2023년 10월 9일,1
2,노랑통닭 건대점,혀닝,노랑통닭은 닭 크기가 작아서 좋음 튀김옷도 두껍지 않은데 바삭바삭하고 양념도 평타이상,배달,엄청 큰 반반치킨 (후라이드 + 양념),2023년 3월 22일,1
3,노랑통닭 건대점,지섭,튀김이 바삭하고 맛있어요~저염이라 하는데 조금 덜 짠거라 싱겁게 먹는 분들에겐 조금 짤꺼같아요,저녁식사 배달,순살3종세트,2019년 5월 6일,1
4,노랑통닭 건대점,호야몽,치킨튀김옷이 굉장히 바삭바삭한편 세가지맛이라 골고루 먹을 수 있어서 좋음 양도 많은 편,배달 저녁식사 서민적인 캐주얼한 푸짐한,세가지맛치킨,2020년 5월 12일,1
5,노랑통닭 건대점,매력이넘치는,노랑통닭 전국투어할기세다 정말 바삭바삭했다 튀김옷이 이집은 조금 자극적이였다,저녁식사 지역주민이찾는,맵싸한고추치킨,2022년 7월 13일,1
6,노랑통닭 건대점,오윤지,노랑통닭 처음먹어봤는데 정말 맛있네요~~ 순살이라 그런지 엄청 부드러웠어요!,저녁식사 캐주얼한 가성비좋은 시끌벅적한 배달 야외좌석(테라스),치즈떡볶이 순살,2019년 10월 6일,1
7,노랑통닭 건대점,봉쏭,,,,2016년 12월 1일,1
0,오늘와인한잔 건대점,이구아날,아늑하게 있기 좋고 간단히 와인 한잔 할 수 있어서 좋음,술모임 데이트 기념일 예쁜 깔끔한 이국적/이색적 경관/야경이좋은,와인 한 잔 초코 아이스크림,2023년 12월 18일,1
1,오늘와인한잔 건대점,경중이,가성비로 좋아요 간단하게 데이트 분위기도 내고 맛있는 안주까지 덤으로! 와인도 아주 맛있었어요!,저녁식사 식사모임 술모임 캐주얼한 가성비좋은,와인 한 잔,2023년 6월 8일,1
2,오늘와인한잔 건대점,kmmmm,"와인 가성비 좋아요! 안주는 가격에 비해 양이 매우 적어서 가성비가 별로지만, 2차로 가는 곳이라서 나쁘진않습니당.",술모임 가성비좋은 예쁜,와인 한 잔,2023년 2월 1일,1
3,오늘와인한잔 건대점,요리왕주연,간단하게 술 한 잔하기 좋은 곳이고 와인 잘 몰라도 설명 잘 적혀있고해서 친구랑 술먹기 좋은 곳 같아요,술모임 데이트 캐주얼한 가성비좋은 시끌벅적한 깔끔한,치즈플래터,2022년 7월 1일,1
